編號,資料集名稱,資料來源(部會單位),第一層級,第二層級,第三層級,資料量,下載次數,瀏覽次數,主要欄位,最後更新時間
184,基隆市104年使用牌照稅稽徵,基隆市稅務局,基隆市政府,,,,1,51,機動車輛種類、應稅車輛件數、應稅車輛稅額、臨時牌照車輛件數、臨時牌照車輛稅額、試車牌照車輛件數、試車牌照車輛稅額、免稅車輛件數,
185,基隆市105年使用牌照稅稅源統計表,基隆市稅務局,基隆市政府,,,,7,56,汽缸排氣量、自用小客車免稅輛數、自用小客車應稅輛數、自用小客車稅額、營業小客車免稅輛數、營業小客車應稅輛數、營業小客車稅額、大客車免稅輛數、大客車應稅輛數、大客車稅額、貨車免稅輛數、貨車應稅輛數、貨車稅額、機器腳踏車免稅輛數、機器腳踏車應稅輛數、機器腳踏車稅額,
186,基隆市105年上期使用牌照稅徵績(滯納期滿),基隆市稅務局,基隆市政府,,,,1,53,種     類、查定輛數、查定稅額、徵起輛數、徵起稅額、徵績輛數(%)、徵績稅額(%),
187,基隆市105年下期使用牌照稅徵績(滯納期滿),基隆市稅務局,基隆市政府,,,,1,51,種     類、查定輛數、查定稅額、徵起輛數、徵起稅額、徵績輛數(%)、徵績稅額(%),
188,基隆市105年上期使用牌照稅徵績(徵期結束),基隆市稅務局,基隆市政府,,,,1,46,種     類、查定輛數、查定稅額、徵起輛數、徵起稅額、徵績輛數(%)、徵績稅額(%),
189,基隆市105年下期使用牌照稅徵績(徵期結束),基隆市稅務局,基隆市政府,,,,1,48,種     類、查定輛數、查定稅額、徵起輛數、徵起稅額、徵績輛數(%)、徵績稅額(%),
190,基隆市105年使用牌照稅稽徵,基隆市稅務局,基隆市政府,,,,1,48,機動車輛種類、應稅車輛件數、應稅車輛稅額、臨時牌照車輛件數、臨時牌照車輛稅額、試車牌照車輛件數、試車牌照車輛稅額、免稅車輛件數,
191,基隆市106年上期使用牌照稅徵績(滯納期滿),基隆市稅務局,基隆市政府,,,,0,44,種     類、查定輛數、查定稅額、徵起輛數、徵起稅額、徵績輛數(%)、徵績稅額(%),
192,基隆市106年上期使用牌照稅徵績(徵期結束),基隆市稅務局,基隆市政府,,,,1,48,種     類、查定輛數、查定稅額、徵起輛數、徵起稅額、徵績輛數(%)、徵績稅額(%),
193,基隆市106年使用牌照稅稽徵,基隆市稅務局,基隆市政府,,,,0,35,機動車輛種類、應稅車輛件數、應稅車輛稅額、臨時牌照車輛件數、臨時牌照車輛稅額、試車牌照車輛件數、試車牌照車輛稅額、免稅車輛件數,
194,107年6月基隆市現住人口按性別年齡,基隆市政府民政處,基隆市政府,,,,79,251,、1.6-現住人口按性別及年齡,
195,107年6月基隆市現住原住民人數,基隆市政府民政處,基隆市政府,,,,1,71,1.7-現住原住民人數、,
196,107年6月基隆市原住民人口按性別及年齡,基隆市政府民政處,基隆市政府,,,,2,73,、1.8-原住民人口按性別及年齡,
197,107年6月基隆市原住民人口按性別及族別,基隆市政府民政處,基隆市政府,,,,5,79,1.9-基隆市原住民人口按性別及族別、,
198,107年6月基隆市各里戶數及人口數,基隆市政府民政處,基隆市政府,,,,53,455,基隆市107年6月各里戶數及人口數、,
199,104年娛樂稅稅源月報表,基隆市稅務局,基隆市政府,,,,2,28,類別、項目、家(件)數、營業總額、本月份稅額、本年度截至本月底累計稅額、實徵稅額、本年度截至本月底累計實徵稅額,
200,105年娛樂稅稅源月報表,基隆市稅務局,基隆市政府,,,,5,41,類別、項目、家(件)數、營業總額、本月份稅額、本年度截至本月底累計稅額、實徵稅額、本年度截至本月底累計實徵稅額,
201,106年1至6月娛樂稅稅源月報表,基隆市稅務局,基隆市政府,,,,1,39,類別、項目、家(件)數、營業總額、本月份稅額、本年度截至本月底累計稅額、實徵稅額、本年度截至本月底累計實徵稅額,
202,基隆市104年印花稅徵收,基隆市稅務局,基隆市政府,,,,0,42,年度、出售印花稅票、彙總自繳稅額、大額繳納,
203,基隆市105年印花稅徵收,基隆市稅務局,基隆市政府,,,,0,41,年度、出售印花稅票、彙總自繳稅額、大額繳納,
204,基隆市106年第1-2季印花稅徵收,基隆市稅務局,基隆市政府,,,,1,47,年度、出售印花稅票、彙總自繳稅額、大額繳納,
205,104年土地增值稅徵收月報表,基隆市稅務局,基隆市政府,,,,3,51,年月、類別、移轉筆數、移轉面積、土地漲價總數額、查定稅額、應納稅額,
206,105年土地增值稅徵收月報表,基隆市稅務局,基隆市政府,,,,0,27,年月、類別、移轉筆數、移轉面積、土地漲價總數額、查定稅額、應納稅額,
207,106年1至7月土地增值稅徵收月報表,基隆市稅務局,基隆市政府,,,,2,30,年月、類別、移轉筆數、移轉面積、土地漲價總數額、查定稅額、應納稅額,
208,104年土地增值稅稅源統計表,基隆市稅務局,基隆市政府,,,,0,36,年度、稅種、筆數、面積、移轉現值、調整後原地價、改良土地費用、漲價總數額、長期持有減徵、查定稅額、增繳地價抵繳、重劃減徵、徵收減徵、其他減徵、應納稅額,
209,105年土地增值稅稅源統計表,基隆市稅務局,基隆市政府,,,,0,31,年度、稅種、筆數、面積、移轉現值、調整後原地價、改良土地費用、漲價總數額、長期持有減徵、查定稅額、增繳地價抵繳、重劃減徵、徵收減徵、其他減徵、應納稅額,
210,106年房屋稅查定,基隆市稅務局,基隆市政府,,,,2,36,項目別、類別、戶（件）數(應稅)、本稅(應稅)、面積(應稅)、現值(應稅)、戶（件）數(免稅)、面積(免稅)、現值(免稅),
211,105年房屋稅查定,基隆市稅務局,基隆市政府,,,,1,36,項目別、類別、戶（件）數(應稅)、本稅(應稅)、面積(應稅)、現值(應稅)、戶（件）數(免稅)、面積(免稅)、現值(免稅),
212,104年房屋稅查定,基隆市稅務局,基隆市政府,,,,0,35,項目別、類別、戶（件）數(應稅)、本稅(應稅)、面積(應稅)、現值(應稅)、戶（件）數(免稅)、面積(免稅)、現值(免稅),
213,106年房屋稅稽徵(徵期結束),基隆市稅務局,基隆市政府,,,,1,41,查定戶（件）數、查定本稅、徵起戶（件）數、徵起本稅、徵起戶（件）數（％）、徵起本稅（％）,
214,105年房屋稅稽徵(徵期結束),基隆市稅務局,基隆市政府,,,,1,39,查定戶（件）數、查定本稅、徵起戶（件）數、徵起本稅、徵起戶（件）數（％）、徵起本稅（％）,
215,104年房屋稅稽徵(徵期結束),基隆市稅務局,基隆市政府,,,,0,62,查定戶（件）數、查定本稅、徵起戶（件）數、徵起本稅、徵起戶（件）數（％）、徵起本稅（％）,
216,106年房屋稅稽徵(滯納期滿),基隆市稅務局,基隆市政府,,,,0,36,查定戶（件）數、查定本稅、徵起戶（件）數、徵起本稅、徵起戶（件）數（％）、徵起本稅（％）,
217,105年房屋稅稽徵(滯納期滿),基隆市稅務局,基隆市政府,,,,0,35,查定戶（件）數、查定本稅、徵起戶（件）數、徵起本稅、徵起戶（件）數（％）、徵起本稅（％）,
218,104年房屋稅稽徵(滯納期滿),基隆市稅務局,基隆市政府,,,,0,33,查定戶（件）數、查定本稅、徵起戶（件）數、徵起本稅、徵起戶（件）數（％）、徵起本稅（％）,
219,106年房屋稅籍,基隆市稅務局,基隆市政府,,,,6,67,應(免)稅別、類別、公私有別、總計(戶數)、總計(面積)、總計(現值)、鋼骨混凝土造(戶數)、鋼骨混凝土造(面積)、鋼骨混凝土造(現值)、鋼骨造(戶數)、鋼骨造(面積)、鋼骨造(現值)、鋼骨鋼筋混凝土造(戶數)、鋼骨鋼筋混凝土造(面積)、鋼骨鋼筋混凝土造(現值)、鋼筋混凝土造 (戶數)、鋼筋混凝土造 (面積)、鋼筋混凝土造 (現值)、加強磚造(戶數)、加強磚造(面積)、加強磚造(現值)、預鑄混泥土造(戶數)、預鑄混泥土造(面積)、預鑄混泥土造(現值)、石老石古造(戶數)、石老石古造(面積)、石老石古造(現值)、鋼鐵造(未達200平方公尺)(戶數)、鋼鐵造(未達200平方公尺)(面積)、鋼鐵造(未達200平方公尺) (現值)、鋼鐵造(200平方公尺以上)(戶數)、鋼鐵造(200平方公尺以上)(面積)、鋼鐵造(200平方公尺以上)(現值)、雜木以外 (戶數)、雜木以外(面積)、雜木以外(現值)、雜木(戶數)、雜木(面積)、雜木(現值)、卵石混凝土造 (戶數)、卵石混凝土造 (面積)、卵石混凝土造 (現值)、磚石造(戶數)、磚石造(面積)、磚石造(現值)、土磚混合造(戶數)、土磚混合造(面積)、土磚混合造(現值)、竹造(戶數)、竹造(面積)、竹造(現值)、冷氣機 (戶數)、冷氣機 (面積)、冷氣機 (現值)、升降機(戶數)、升降機 (面積)、升降機 (現值)、純土造(戶數)、純土造(面積)、純土造(現值)、充氣屋(戶數)、充氣屋(面積)、充氣屋(現值)、油槽(戶數)、油槽(面積)、油槽(現值)、其他 (戶數)、其他 (面積)、其他 (現值),
220,105年房屋稅籍,基隆市稅務局,基隆市政府,,,,4,54,應(免)稅別、類別、公私有別、總計(戶數)、總計(面積)、總計(現值)、鋼骨混凝土造(戶數)、鋼骨混凝土造(面積)、鋼骨混凝土造(現值)、鋼骨造(戶數)、鋼骨造(面積)、鋼骨造(現值)、鋼骨鋼筋混凝土造(戶數)、鋼骨鋼筋混凝土造(面積)、鋼骨鋼筋混凝土造(現值)、鋼筋混凝土造 (戶數)、鋼筋混凝土造 (面積)、鋼筋混凝土造 (現值)、加強磚造(戶數)、加強磚造(面積)、加強磚造(現值)、預鑄混泥土造(戶數)、預鑄混泥土造(面積)、預鑄混泥土造(現值)、石造(戶數)、石造(面積)、石造(現值)、鋼鐵造(未達200平方公尺)(戶數)、鋼鐵造(未達200平方公尺)(面積)、鋼鐵造(未達200平方公尺) (現值)、鋼鐵造(200平方公尺以上)(戶數)、鋼鐵造(200平方公尺以上)(面積)、鋼鐵造(200平方公尺以上)(現值)、雜木以外 (戶數)、雜木以外(面積)、雜木以外(現值)、雜木(戶數)、雜木(面積)、雜木(現值)、卵石混凝土造 (戶數)、卵石混凝土造 (面積)、卵石混凝土造 (現值)、磚石造(戶數)、磚石造(面積)、磚石造(現值)、土磚混合造(戶數)、土磚混合造(面積)、土磚混合造(現值)、竹造(戶數)、竹造(面積)、竹造(現值)、冷氣機 (戶數)、冷氣機 (面積)、冷氣機 (現值)、升降機(戶數)、升降機 (面積)、升降機 (現值)、純土造(戶數)、純土造(面積)、純土造(現值)、充氣屋(戶數)、充氣屋(面積)、充氣屋(現值)、油槽(戶數)、油槽(面積)、油槽(現值)、其他 (戶數)、其他 (面積)、其他 (現值),
221,104年房屋稅籍,基隆市稅務局,基隆市政府,,,,2,40,應(免)稅別、類別、公私有別、總計(戶數)、總計(面積)、總計(現值)、鋼骨混凝土造(戶數)、鋼骨混凝土造(面積)、鋼骨混凝土造(現值)、鋼骨造(戶數)、鋼骨造(面積)、鋼骨造(現值)、鋼骨鋼筋混凝土造(戶數)、鋼骨鋼筋混凝土造(面積)、鋼骨鋼筋混凝土造(現值)、鋼筋混凝土造 (戶數)、鋼筋混凝土造 (面積)、鋼筋混凝土造 (現值)、加強磚造(戶數)、加強磚造(面積)、加強磚造(現值)、預鑄混泥土造(戶數)、預鑄混泥土造(面積)、預鑄混泥土造(現值)、勞咕石造(戶數)、勞咕石造(面積)、勞咕石造(現值)、鋼鐵造(<90*90*6) (戶數)、鋼鐵造(<90*90*6) (面積)、鋼鐵造(<90*90*6) (現值)、鋼鐵造(>90*90*6)(戶數)、鋼鐵造(>90*90*6)(面積)、鋼鐵造(>90*90*6)(現值)、雜木以外 (戶數)、雜木以外(面積)、雜木以外(現值)、雜木(戶數)、雜木(面積)、雜木(現值)、卵石混凝土造 (戶數)、卵石混凝土造 (面積)、卵石混凝土造 (現值)、磚石造(戶數)、磚石造(面積)、磚石造(現值)、土磚混合造(戶數)、土磚混合造(面積)、土磚混合造(現值)、竹造(戶數)、竹造(面積)、竹造(現值)、冷氣機 (戶數)、冷氣機 (面積)、冷氣機 (現值)、升降機(戶數)、升降機 (面積)、升降機 (現值)、純土造(戶數)、純土造(面積)、純土造(現值)、充氣屋(戶數)、充氣屋(面積)、充氣屋(現值)、油槽(戶數)、油槽(面積)、油槽(現值)、其他 (戶數)、其他 (面積)、其他 (現值),
222,106年第1至2季契稅查定,基隆市稅務局,基隆市政府,,,,0,49,年月、項目、本季查定件數(合計)、本季查定件數(應稅)、本季查定件數(免稅)、本季查定契價(合計)、本季查定契價(應稅)、本季查定契價(免稅)、本季查定本稅(合計)、本季查定本稅(應稅)、本季查定本稅(免稅)、截至本季底止累計查定件數(合計)、截至本季底止累計查定件數(應稅)、截至本季底止累計查定件數(免稅)、截至本季底止累計查定契價(合計)、截至本季底止累計查定契價(應稅)、截至本季底止累計查定契價(免稅)、截至本季底止累計查定本稅(合計)、截至本季底止累計查定本稅(應稅)、截至本季底止累計查定本稅(免稅),
223,105年第1至4季契稅徵收,基隆市稅務局,基隆市政府,,,,0,41,年月、項目、本季實徵件數(合計)、本季實徵件數(免稅)、本季實徵件數(應稅)、本季實徵契價、本季實徵本稅、截至本季底止累計實徵件數(合計)、截至本季底止累計實徵件數件數(免稅)、截至本季底止累計實徵件數件數(應稅)、截至本季底止累計實徵件數契價、截至本季底止累計實徵件數本稅,
224,104年第1至4季契稅徵收,基隆市稅務局,基隆市政府,,,,0,34,年月、項目、本季實徵件數(合計)、本季實徵件數(免稅)、本季實徵件數(應稅)、本季實徵契價、本季實徵本稅、截至本季底止累計實徵件數(合計)、截至本季底止累計實徵件數件數(免稅)、截至本季底止累計實徵件數件數(應稅)、截至本季底止累計實徵件數契價、截至本季底止累計實徵件數本稅,
225,105年地價稅查定,基隆市稅務局,基隆市政府,,,,0,40,稅地種類、戶數、筆數、課稅面積、課稅地價、地價稅額,
226,104年地價稅查定,基隆市稅務局,基隆市政府,,,,1,33,稅地種類、戶數、筆數、課稅面積、課稅地價、地價稅額,
227,105年地價稅稽徵(徵期結束),基隆市稅務局,基隆市政府,,,,1,31,公私有別、原查定件數 A、原查定稅額A、徵期或滯納期增減件數 B、徵期或滯納期增減稅額B、調整後查定件數C = A±B、調整後查定稅額C = A±B、徵起件數D、徵起稅額D、未徵起件數E= C-D、未徵起稅額E= C-D、徵起率件數F=D/C(%)、徵起率稅額F=D/C(%),
228,105年地價稅稽徵(滯納期滿),基隆市稅務局,基隆市政府,,,,0,35,公私有別、原查定件數 A、原查定稅額A、徵期或滯納期增減件數 B、徵期或滯納期增減稅額B、調整後查定件數C = A±B、調整後查定稅額C = A±B、徵起件數D、徵起稅額D、未徵起件數E= C-D、未徵起稅額E= C-D、徵起率件數F=D/C(%)、徵起率稅額F=D/C(%),
229,基隆市消防安全檢查重大不合格,基隆市消防局,基隆市政府,,,,1,61,場所名稱、場所地點、檢查結果、檢查日期,
230,車輛偵測器靜態資料,基隆市政府交通旅遊處,基隆市政府,,,,7,73,Info,
231,AVI靜態資料,基隆市政府交通旅遊處,基隆市政府,,,,2,49,Info,
232,CCTV靜態資訊,基隆市政府交通旅遊處,基隆市政府,,,,18,86,Info,
233,CMS靜態資訊,基隆市政府交通旅遊處,基隆市政府,,,,2,56,Info,
234,路段靜態資訊,基隆市政府交通旅遊處,基隆市政府,,,,7,62,Info,
235,基隆市早期療育服務通報轉介中心,基隆市政府社會處,基隆市政府,,,,3,89,性質、主管機關、辦理單位、成立日期、立案文號、負責人、連絡電話、傳真、電子郵件、地址、相關網址、X坐標、Y坐標、備註、最後更新時間,
236,106年有線電視數位化普及率,基隆市政府行政處,基隆市政府,,,,17,82,縣市別、數位機上盒普及率、,
237,基隆市老人福利機構,基隆市政府社會處,基隆市政府,,,,7,80,性質、主管機關、辦理單位、成立日期、立案文號、負責人、連絡電話、傳真、電子郵件、地址、核定收容人數、收容對象_安養、收容對象_養護、收容對象_長照、收容對象_日照、收容對象_失智、收容對象_遊民、收容對象_其他、相關網站、X坐標、Y坐標、備註、最後更新時間,
238,單親家庭服務提供單位,基隆市政府社會處,基隆市政府,,,,2,60,主管機關、辦理單位、連絡電話、傳真、電子郵件、地址、相關網站、X坐標、Y坐標、備註、最後更新時間,
239,基隆市中低老人及弱勢假牙醫療診所,基隆市政府社會處,基隆市政府,,,,1,42,主管機關、機構名稱、連絡電話、X坐標、Y坐標、備註、最後更新時間,
240,基隆市老人、身心障礙餐飲服務,基隆市政府社會處,基隆市政府,,,,5,52,主管機關、機構名稱、地址、連絡電話、X坐標、Y坐標、備註、最後更新時間,
241,基隆市老人日托中心,基隆市政府社會處,基隆市政府,,,,6,87,性質、主管機關、辦理單位、成立日期、立案文號、負責人、連絡電話、傳真、電子郵件、地址、可服務人數、相關網站、X坐標、Y坐標、備註、最後更新時間,
242,基隆市身心障礙住宿機構,基隆市政府社會處,基隆市政府,,,,5,69,性質、主管機關、辦理單位、成立日期、立案文號、負責人、連絡電話、傳真、電子郵件、地址、核定服務人數_全日型住宿、核定服務人數_夜間型住宿、核定服務人數_日間照顧、核定服務人數_部分時制照顧、核定服務人數_總計、相關網站、X坐標、Y坐標、備註、最後更新時間,
243,基隆市身心障礙日間服務機構,基隆市政府社會處,基隆市政府,,,,5,49,性質、主管機關、辦理單位、成立日期、立案文號、負責人、連絡電話、傳真、電子郵件、地址、核定服務人數_全日型住宿人數、核定服務人數_夜間型住宿人數、核定服務人數_日間照顧人數、核定服務人數_部分時制照顧人數、核定服務人數_總計、相關網站、X坐標、Y坐標、備註、最後更新時間,
244,基隆市日間照顧中心,基隆市政府社會處,基隆市政府,,,,5,100,性質、主管機關、辦理單位、成立日期、立案文號、負責人、連絡電話、傳真、電子郵件、地址、可服務人數、相關網站、X坐標、Y坐標、備註、最後更新時間,
245,基隆市早期療育服務個案管理中心,基隆市政府社會處,基隆市政府,,,,2,48,性質、主管機關、辦理單位、成立日期、立案文號、負責人、連絡電話、傳真、電子郵件、地址、相關網址、X坐標、Y坐標、備註、最後更新時間,
246,基隆市輔具服務單位,基隆市政府社會處,基隆市政府,,,,5,52,性質、主管機關、單位名稱、辦理單位、連絡電話、傳真、電子郵件、地址、相關網站、X坐標、Y坐標、備註、最後更新時間,
247,基隆市身心障礙友善餐廳,基隆市政府社會處,基隆市政府,,,,13,93,主管機關、機構名稱、地址、連絡電話、X坐標、Y坐標、備註、最後更新時間,
248,基隆市身心障礙職業重建服務資源中心,基隆市政府社會處,基隆市政府,,,,4,111,主管機關、辦理單位、連絡電話、傳真、電子郵件、地址、相關網站、X坐標、Y坐標、備註、最後更新時間,
249,基隆市身心障礙復康巴士服務,基隆市政府社會處,基隆市政府,,,,9,176,主管機關、科室、親辦地址、管理人、申請電話、傳真申請、X坐標、Y坐標、備註、最後更新時間,
250,基隆市高風險家庭關懷輔導處遇服務據點,基隆市政府社會處,基隆市政府,,,,1,51,主管機關、辦理單位、成立日期、立案文號、負責人、連絡電話、傳真、電子郵件、地址、相關網站、X坐標、Y坐標、備註、最後更新時間,
251,基隆市居家喘息服務提供單位,基隆市政府社會處,基隆市政府,,,,2,72,主管機關、名稱、地址、聯絡人、連絡電話、X坐標、Y坐標、備註、最後更新時間,
252,基隆市居家護理機構,基隆市政府社會處,基隆市政府,,,,6,56,主管機關、名稱、地址、負責人、連絡電話、X坐標、Y坐標、備註、最後更新時間,
253,基隆市國際家庭服務中心(新住民服務),基隆市政府社會處,基隆市政府,,,,1,63,主管機關、中心名稱、連絡電話、傳真、電子郵件、地址、相關網站、X坐標、Y坐標、備註、最後更新時間,
254,基隆市公共哺集乳室,基隆市政府社會處,基隆市政府,,,,3,83,主管機關、名稱、地址、連絡電、X坐標、Y坐標、備註、最後更新時間,
255,基隆市就業服務據點,基隆市政府社會處,基隆市政府,,,,8,72,主管機關、辦理單位、連絡電話、傳真、電子郵件、地址、相關網站、X坐標、Y坐標、備註、最後更新時間,
256,基隆市食物銀行,基隆市政府社會處,基隆市政府,,,,8,74,主管機關、機構名稱、地址、連絡電話、X坐標、Y坐標、備註、最後更新時間,
257,基隆市社區活動中心,基隆市政府社會處,基隆市政府,,,,32,104,主管機關、名稱、地址、連絡電話、X坐標、Y坐標、備註、最後更新時間,
258,基隆市衛生所列表,基隆市政府社會處,基隆市政府,,,,4,84,主管機關、名稱、地址、連絡電話、X坐標、Y坐標、備註、最後更新時間,
259,基隆市戒毒機構,基隆市政府社會處,基隆市政府,,,,2,58,主管機關、名稱、地址、負責人、連絡電話、X坐標、Y坐標、備註、最後更新時間,
260,基隆市心理諮商服務據點,基隆市政府社會處,基隆市政府,,,,6,105,主管機關、名稱、地址、負責人、連絡電話、X坐標、Y坐標、備註、最後更新時間,
261,基隆市長期照顧管理中心,基隆市政府社會處,基隆市政府,,,,6,66,主管機關、名稱、地址、連絡電話、相關連結、X坐標、Y坐標、備註、最後更新時間,
262,基隆市護理之家,基隆市政府社會處,基隆市政府,,,,7,73,主管機關、名稱、地址、負責人、連絡電話、開放床數、X坐標、Y坐標、備註、最後更新時間,
263,基隆市政府基地臺NCC列管情形,基隆市政府研考處,基隆市政府,,,,2,67,主辦機關填報106年09月,
264,97-105團隊名冊,基隆市文化局,基隆市政府,,,,0,51,年度、類別、團體名稱,
265,展覽室及文化館舍開放時間表,基隆市文化局,基隆市政府,,,,1,64,展覽室及文化館舍開放時間表、,
266,基隆市政府廠商遠端連線申請,基隆市政府研考處,基隆市政府,,,,0,71,名 稱、次數,
267,基隆市政府員工資訊服務申請,基隆市政府研考處,基隆市政府,,,,0,50,名 稱、次數,
268,研考處資訊管理科男女比例,基隆市政府研考處,基隆市政府,,,,5,64,性別、人數、百分比,
269,臺灣基隆地方法院106年度10月份會計月報,臺灣基隆地方法院,基隆市政府,,,,0,44,,
270,基隆市消防局救護服務統計表,基隆市消防局,基隆市政府,,,,2,81,年度;月份;出勤次數;送醫人數;車禍;一般外傷;路倒;急病;其他救護,
271,105年1-6月國家賠償統計表,基隆市政府行政處,基隆市政府,,,,1,42,舊收案件件數、1,
272,105年7-12月國家賠償統計表,基隆市政府行政處,基隆市政府,,,,4,47,舊收案件件數、0,
273,106年飲用水水質檢測報告,基隆市環境保護局,基隆市政府,,,,17,291,一月份採樣結果、,
274,基隆市102年至106年學校廚餘回收數據,基隆市環境保護局,基隆市政府,,,,30,291,單位、一月、二月、三月、四月、五月、六月、七月、八月、九月、十月、十一月、十二月,
275,105年飲用水水質檢測報告,基隆市環境保護局,基隆市政府,,,,3,69,一月份採樣結果、,
276,106年度河川品質監測數據,基隆市環境保護局,基隆市政府,,,,6,193,一月份採樣結果、,
277,105年度河川品質監測數據,基隆市環境保護局,基隆市政府,,,,16,180,一月份採樣結果、,
278,基隆市不動產租賃實價登錄Open Data(106年9月租賃登記案件),基隆市政府地政處,基隆市政府,,,,10,71,鄉鎮市區、租賃標的、土地區段位置或建物區門牌、租賃總面積平方公尺、都市土地使用分區、非都市土地使用分區、非都市土地使用編定、租賃年月日、租賃筆棟數、租賃層次、總樓層數、建物型態、主要用途、主要建材、建築完成年月、建物現況格局-房、建物現況格局-廳、建物現況格局-衛、建物現況格局-隔間、有無管理組織、有無附傢俱、總額元、單價每平方公尺、車位類別、租金總額元、備註、編號,
279,106年度10月基隆市土地建物登記管理資料,基隆市政府地政處,基隆市政府,,,,5,65,公　、開　、類、、編製機、關、基隆市政府(、地政處),
